{
  "schemaVersion": "SourceContractPackManifest.v1",
  "contractPackId": "contract:source-pack:application-cmdb:v1",
  "packVersion": "1.0.0",
  "sourceFamily": "application_cmdb",
  "title": "Application portfolio, business service, and configuration inventory synthetic contract pack",
  "purpose": "Prove product-neutral pagination and mapping for application, service, deployment, environment, region, and lifecycle context.",
  "provenance": {
    "origin": "independently_authored_synthetic",
    "contractEvidenceStatus": "synthetic_contract_tested",
    "retrievalRequired": false,
    "redistributionStatus": "independently_authored_public_fixture"
  },
  "access": {
    "classification": "synthetic_local",
    "authenticationMode": "simulated_reference",
    "credentialReferenceOnly": true,
    "readOnly": true
  },
  "pagination": {
    "mode": "opaque_cursor",
    "pageSizeLimit": 100,
    "cursorIsOpaqueReference": true,
    "rawCursorStored": false,
    "terminalCondition": "next_cursor_ref_is_null"
  },
  "responseContractRef": "contract:synthetic-source-page.v1",
  "fixturePageRefs": ["fixtures/page-001.v1.json", "fixtures/page-002.v1.json"],
  "canonicalMappings": [
    {
      "sourceField": "attributes.applicationRef",
      "canonicalTarget": "asset.applicationRef",
      "required": true,
      "semanticNote": "Opaque synthetic application identity used only for deterministic correlation."
    },
    {
      "sourceField": "attributes.serviceRef",
      "canonicalTarget": "dependency.businessServiceRef",
      "required": true,
      "semanticNote": "Links the deployment to its synthetic business-service context without naming a person."
    },
    {
      "sourceField": "attributes.deploymentRef",
      "canonicalTarget": "asset.deploymentRef",
      "required": true,
      "semanticNote": "Identifies one independently enumerated deployment unit in the authorized scope."
    },
    {
      "sourceField": "attributes.regionRef",
      "canonicalTarget": "asset.regionRef",
      "required": true,
      "semanticNote": "Preserves the synthetic regional placement used by the two-region proof."
    }
  ],
  "conformanceBehaviors": [
    "pagination",
    "rate_limit_retry",
    "timeout_retry",
    "duplicate_delivery",
    "authorization_failure",
    "malformed_record_quarantine",
    "schema_drift_quarantine",
    "cursor_resume"
  ],
  "limitations": [
    "The fixture demonstrates shape and behavior only; it does not claim a particular configuration-management product or enterprise field model.",
    "Synthetic service associations do not establish a real accountable owner or application population denominator."
  ],
  "safety": {
    "synthetic": true,
    "vendorClaimed": false,
    "liveIntegrationClaimed": false,
    "containsCredentials": false,
    "containsRawEnterprisePayload": false
  }
}
